{
  "$schema": "./registry-meta-schema-v1.json",
  "registrySchemaVersion": "ifccad.ifcdr.registry.v1",
  "ifcdrVersion": "0.5.0",
  "resource": {
    "schemaId": "ifccad.ifcdr.resource.v0.5.0",
    "fields": [
      {
        "name": "header",
        "valueType": "object",
        "presence": "required",
        "nullable": false,
        "fields": [
          {
            "name": "format",
            "valueType": "string",
            "presence": "required",
            "nullable": false
          },
          {
            "name": "version",
            "valueType": "string",
            "presence": "required",
            "nullable": false
          },
          {
            "name": "resourceId",
            "valueType": "string",
            "presence": "required",
            "nullable": false
          },
          {
            "name": "unit",
            "valueType": "string",
            "presence": "required",
            "nullable": false
          },
          {
            "name": "nextEntityId",
            "valueType": "uint64",
            "presence": "required",
            "nullable": false
          }
        ]
      },
      {
        "name": "streamDirectory",
        "valueType": "object",
        "presence": "required",
        "nullable": false
      },
      {
        "name": "bounds",
        "valueType": "object",
        "presence": "required",
        "nullable": false,
        "fields": [
          {
            "name": "minX",
            "valueType": "float64",
            "presence": "required",
            "nullable": false
          },
          {
            "name": "minY",
            "valueType": "float64",
            "presence": "required",
            "nullable": false
          },
          {
            "name": "maxX",
            "valueType": "float64",
            "presence": "required",
            "nullable": false
          },
          {
            "name": "maxY",
            "valueType": "float64",
            "presence": "required",
            "nullable": false
          }
        ]
      },
      {
        "name": "scopeTable",
        "valueType": "array",
        "presence": "required",
        "nullable": false
      },
      {
        "name": "streams",
        "valueType": "object",
        "presence": "required",
        "nullable": false
      }
    ]
  },
  "directory": {
    "schemaId": "ifccad.ifcdr.streamDirectory.v1",
    "fields": [
      {
        "name": "version",
        "valueType": "string",
        "presence": "required",
        "nullable": false
      },
      {
        "name": "streams",
        "valueType": "array",
        "presence": "required",
        "nullable": false
      }
    ],
    "entryFields": [
      {
        "name": "name",
        "valueType": "string",
        "presence": "required",
        "nullable": false
      },
      {
        "name": "schema",
        "valueType": "string",
        "presence": "required",
        "nullable": false
      },
      {
        "name": "role",
        "valueType": "string",
        "presence": "required",
        "nullable": false
      },
      {
        "name": "count",
        "valueType": "uint32",
        "presence": "required",
        "nullable": false
      },
      {
        "name": "columns",
        "valueType": "array",
        "presence": "required",
        "nullable": false
      },
      {
        "name": "parent",
        "valueType": "string",
        "presence": "optional",
        "nullable": false
      },
      {
        "name": "children",
        "valueType": "array",
        "presence": "optional",
        "nullable": false
      }
    ]
  },
  "tables": [
    {
      "name": "appearanceBinding",
      "schemaId": "ifccad.ifcdr.appearanceBinding.v1",
      "payloadPath": "appearanceBindings",
      "presence": "optional",
      "rowFields": [
        {
          "name": "id",
          "valueType": "uint32",
          "presence": "required",
          "nullable": false
        },
        {
          "name": "ifcxAppearance",
          "valueType": "ifcxId",
          "presence": "required",
          "nullable": true,
          "reference": {"category": "ifcx", "target": "ifcx"}
        },
        {
          "name": "colorMode",
          "valueType": "uint32",
          "presence": "required",
          "nullable": false
        },
        {
          "name": "opacityMode",
          "valueType": "uint32",
          "presence": "required",
          "nullable": false
        },
        {
          "name": "linePatternMode",
          "valueType": "uint32",
          "presence": "required",
          "nullable": false
        },
        {
          "name": "lineWeightMode",
          "valueType": "uint32",
          "presence": "required",
          "nullable": false
        },
        {
          "name": "overrideId",
          "valueType": "uint32",
          "presence": "required",
          "nullable": true,
          "reference": {"category": "tableField", "target": "appearanceOverrides.id"}
        }
      ]
    },
    {
      "name": "appearanceOverride",
      "schemaId": "ifccad.ifcdr.appearanceOverride.v1",
      "payloadPath": "appearanceOverrides",
      "presence": "optional",
      "rowFields": [
        {
          "name": "id",
          "valueType": "uint32",
          "presence": "required",
          "nullable": false
        },
        {
          "name": "color",
          "valueType": "jsonValue",
          "presence": "required",
          "nullable": true
        },
        {
          "name": "opacity",
          "valueType": "float64",
          "presence": "required",
          "nullable": true
        },
        {
          "name": "ifcxLinePattern",
          "valueType": "ifcxId",
          "presence": "required",
          "nullable": true,
          "reference": {"category": "ifcx", "target": "ifcx"}
        },
        {
          "name": "lineWeight",
          "valueType": "float64",
          "presence": "required",
          "nullable": true
        }
      ]
    },
    {
      "name": "layerBinding",
      "schemaId": "ifccad.ifcdr.layerBinding.v1",
      "payloadPath": "layerBindings",
      "presence": "optional",
      "rowFields": [
        {
          "name": "id",
          "valueType": "uint32",
          "presence": "required",
          "nullable": false
        },
        {
          "name": "ifcxLayer",
          "valueType": "ifcxId",
          "presence": "required",
          "nullable": false,
          "reference": {"category": "ifcx", "target": "ifcx"}
        }
      ]
    },
    {
      "name": "textStyleBinding",
      "schemaId": "ifccad.ifcdr.textStyleBinding.v1",
      "payloadPath": "textStyleBindings",
      "presence": "optional",
      "rowFields": [
        {
          "name": "id",
          "valueType": "uint32",
          "presence": "required",
          "nullable": false
        },
        {
          "name": "ifcxTextStyle",
          "valueType": "ifcxId",
          "presence": "required",
          "nullable": false,
          "reference": {"category": "ifcx", "target": "ifcx"}
        }
      ]
    },
    {
      "name": "dimensionStyleBinding",
      "schemaId": "ifccad.ifcdr.dimensionStyleBinding.v1",
      "payloadPath": "dimensionStyleBindings",
      "presence": "optional",
      "rowFields": [
        {
          "name": "id",
          "valueType": "uint32",
          "presence": "required",
          "nullable": false
        },
        {
          "name": "ifcxDimensionStyle",
          "valueType": "ifcxId",
          "presence": "required",
          "nullable": false,
          "reference": {"category": "ifcx", "target": "ifcx"}
        }
      ]
    },
    {
      "name": "hatchPatternBinding",
      "schemaId": "ifccad.ifcdr.hatchPatternBinding.v1",
      "payloadPath": "hatchPatternBindings",
      "presence": "optional",
      "rowFields": [
        {
          "name": "id",
          "valueType": "uint32",
          "presence": "required",
          "nullable": false
        },
        {
          "name": "ifcxHatchPattern",
          "valueType": "ifcxId",
          "presence": "required",
          "nullable": false,
          "reference": {"category": "ifcx", "target": "ifcx"}
        }
      ]
    },
    {
      "name": "namedUcsBinding",
      "schemaId": "ifccad.ifcdr.namedUcsBinding.v1",
      "payloadPath": "namedUcsBindings",
      "presence": "optional",
      "rowFields": [
        {
          "name": "id",
          "valueType": "uint32",
          "presence": "required",
          "nullable": false
        },
        {
          "name": "ifcxNamedUcs",
          "valueType": "ifcxId",
          "presence": "required",
          "nullable": false,
          "reference": {"category": "ifcx", "target": "ifcx"}
        }
      ]
    },
    {
      "name": "dimensionOverride",
      "schemaId": "ifccad.ifcdr.dimensionOverride.v1",
      "payloadPath": "dimensionOverrideTable",
      "presence": "required",
      "rowFields": [
        {
          "name": "id",
          "valueType": "uint32",
          "presence": "required",
          "nullable": false
        },
        {
          "name": "dimensionLineAppearanceId",
          "valueType": "uint32",
          "presence": "required",
          "nullable": true,
          "reference": {"category": "tableField", "target": "appearanceBindings.id"}
        },
        {
          "name": "extensionLineAppearanceId",
          "valueType": "uint32",
          "presence": "required",
          "nullable": true,
          "reference": {"category": "tableField", "target": "appearanceBindings.id"}
        },
        {
          "name": "extensionLineOffset",
          "valueType": "float64",
          "presence": "required",
          "nullable": true
        },
        {
          "name": "extensionLineOvershoot",
          "valueType": "float64",
          "presence": "required",
          "nullable": true